<?xml version="1.0" encoding="UTF-8" standalone="no"?>
<?xml-stylesheet href="drugsmodel.xsl" type="text/xsl" ?>
<model xmlns:xsi="http://www.w3.org/2001/XMLSchema-instance" version="0.6" xsi:noNamespaceSchemaLocation="drug.xsd">

  <!-- Drug history -->

  <history>
    <creator>
      <name>Sylvain Goutelle</name>
      <institution>CHUV</institution>
      <email>sylvain.goutelle@chuv.ch</email>
      <date>2017-08-07</date>
      <comments>
          <comment lang="en">Based on article of Romano et al
         Population pharmacokinetics of amikacin in patients with haematological malignancies</comment>
        <comment lang="en">
        Age mean : 53 +/- 16.4  years
        Weight mean : 64.8 +/- 10.7 kg
        Disease : Adult patients with hematological malignancies
        </comment>
        </comments>
    </creator>
    <revisions>
      <revision>
        <name>Yann Thoma</name>
        <institution>HEIG-VD</institution>
        <email>yann.thoma@heig-vd.ch</email>
        <date>2017-08-14</date>
                <comments>
        <comment lang="en">Corrected CL operation
        </comment>
        </comments>
      </revision>
    </revisions>
  </history>

  <!-- Drug data -->

  <drug>

    <!-- Drug description -->

    <head>
      <atc>J01XA01</atc>
      <drugid>amikacin</drugid>
      <drugmodelid>ch.heig-vd.ezechiel.amikacin.adult_1CP</drugmodelid>
      <pkmodelid>ezechiel.model.linear.1comp.infus.clv</pkmodelid>
      <drugnames>
        <name lang="en">Amikacin</name>
        <name lang="fr">Amikacin</name>
      </drugnames>
      <domainnames>
        <name lang="en">Adult  patients</name>
        <name lang="fr">Patients adultes </name>
      </domainnames>
      <studynames>
        <name lang="en">Population pharmacokinetics of amikacin in patients with haematological malignancies</name>
      </studynames>
      <references>
      </references>
      <descs>
        <desc lang="en">...</desc>
        <desc lang="fr">...</desc>
      </descs>
      <brands>
        <brand>Amikacin</brand>
      </brands>
      <comments/>
    </head>

    <!-- Drug adme and intake -->

    <adme>
      <intake>infu</intake>
      <distribution>1</distribution>
      <elimination>linear</elimination>
      <comments/>
    </adme>

    <!-- Drug half-life -->

    <halflife>
      <unit>h</unit>
      <value>3</value>
      <multiplier>10</multiplier>
      <comments/>
    </halflife>

    <!-- Drug units and conversions -->

    <conversions>
      <units>
        <concentration>mg/l</concentration>
        <result>mg/l</result>
      </units>
      <factors>
        <concentration>0</concentration>
        <result>0</result>
      </factors>
      <molarmass>0</molarmass>
      <comments>
			<comment lang="en">No conversion</comment>
			<comment lang="fr">Pas de conversion</comment>
        </comments>
    </conversions>

    <!-- Drug dosages -->

    <dosages>
      <doses default="1250" unit="mg" any="true" from="300" to="4000" step="50">
      </doses>
      <intervals default="12" unit="h" any="false">
        <interval>6</interval>
        <interval>8</interval>
        <interval>12</interval>
        <interval>16</interval>
        <interval>24</interval>
        <interval>30</interval>
        <interval>36</interval>
        <interval>42</interval>
        <interval>48</interval>
        <interval>60</interval>
        <interval>72</interval>
      </intervals>
      <infusions default="30" unit="min" any="false">
        <infusion>5</infusion>
        <infusion>10</infusion>
        <infusion>15</infusion>
        <infusion>30</infusion>
        <infusion>45</infusion>
        <infusion>60</infusion>
		<infusion>75</infusion>
		<infusion>90</infusion>
		<infusion>105</infusion>
		<infusion>120</infusion>
      </infusions>
      <comments>
			</comments>
    </dosages>

    <!-- Drug targets -->

    <targets>
   <target>
        <type>peak</type>
        <concentrations unit="mg/l">
          <min>
            <value>40</value>
            <formula/>
          </min>
          <max>
            <value>100</value>
            <formula/>
          </max>
          <best>
            <value>60</value>
            <formula/>
          </best>
        </concentrations>
        <times unit="h">
          <min>
            <value>0.5</value>
            <formula/>
          </min>
          <max>
            <value>1.5</value>
            <formula/>
          </max>
          <best>
            <value>1</value>
            <formula/>
          </best>
        </times>
        <comments/>
      </target>
      <target>
        <type>residual</type>
        <concentrations unit="mg/l">
          <min>
            <value>0.1</value>
            <formula/>
          </min>
          <max>
            <value>2.5</value>
            <formula/>
          </max>
          <best>
            <value>1</value>
            <formula/>
          </best>
        </concentrations>
        <comments>
        </comments>
      </target>
    </targets>

    <!-- Drug covariates -->

    <covariates>
      <covariate>
        <id>CLcr</id>
        <names>
          <name lang="en">Clearance of creatinine</name>
          <name lang="fr">Clairance de la créatinine</name>
        </names>
        <descs>
          <desc lang="en">Clearance of creatinine</desc>
          <desc lang="fr">Clairance de la créatinine</desc>
        </descs>
        <unit>ml/min</unit>
        <type>double</type>
        <defaultvalue>80</defaultvalue>
        <comments>
				<comment lang="en">Approximated mean value in study population
        Caution: CLcr is in L/h in amikacin clearance equation. We use CLcr (ml/min)*0.06 for conversion in the TVCL operation, see below
        </comment>
			</comments>
      </covariate>

      <covariate>
        <id>bodyweight</id>
        <names>
          <name lang="en">Total Body Weight</name>
          <name lang="fr">Poids total</name>
        </names>
        <descs>
          <desc lang="en">Total body weight of patient, in kilogramms</desc>
          <desc lang="fr">Poids total du patient, en kilogramme</desc>
        </descs>
        <unit>kg</unit>
        <type>double</type>
        <defaultvalue>65</defaultvalue>
        <comments>
				<comment lang="en">Approximated mean value in study population</comment>
			</comments>
      </covariate>

      <covariate>
        <id>ALBless35</id>
        <names>
          <name lang="en">Hypo-albuminemia</name>
          <name lang="fr">Hypo-albuminemia</name>
        </names>
        <descs>
          <desc lang="en">Serum albumine lower than 35 g/L</desc>
        </descs>
        <unit/>
        <type>bool</type>
        <defaultvalue>0</defaultvalue>
        <comments/>
      </covariate>

      <covariate>
        <id>AML</id>
        <names>
          <name lang="en">Acute myeloblastic leukemia</name>
          <name lang="fr">Leucémie aigue myéloblastique</name>
        </names>
        <descs>
          <desc lang="en">Patient with acute myeloblastic leukemia</desc>
        </descs>
        <unit/>
        <type>bool</type>
        <defaultvalue>0</defaultvalue>
        <comments/>
      </covariate>

    </covariates>



    <!-- Drug error model -->

    <errormodel>
      <additive>0.0</additive>
      <proportional>0.341</proportional>
      <comments>
			</comments>
    </errormodel>

    <!-- Drug parameters -->

    <parameters>
      <parameter>
        <id>CL</id>
        <unit>l/h</unit>
        <value>5.66</value>
        <bsv>
          <additive>0.0</additive>
          <proportional>0.287</proportional>
        </bsv>
        <min>0</min>
        <max>100</max>
        <step>0.01</step>
        <comments>
				<comment lang="en">Typical clearance calculated for a patients with CCR = 85 ml/min = 5.1 L/h</comment>
			</comments>
      </parameter>

      <parameter>
        <id>V1</id>
        <unit>l</unit>
        <value>24.05</value>
        <bsv>
          <additive>0.0</additive>
          <proportional>0.262</proportional>
        </bsv>
        <min>0</min>
        <max>200</max>
        <step>0.01</step>
        <comments>
				<comment lang="en">Typical volume calculated for an infected patient with weight = 65 kg</comment>
			</comments>
      </parameter>

	</parameters>

    <!-- Drug correlations -->

    <correlations>
    </correlations>

    <!-- Drug operations -->

    <operations>
      <operation>
        <parameter>CL</parameter>
        <formula><![CDATA[
CCR = covariate_CLcr;
ALB= covariate_AML;

theta_1 = 1.11;
theta_2 = 0.2;

TVCL = theta_1 * (CCR*0.06)*(1+theta_2*ALB);
return TVCL;
        ]]></formula>
        <comments><comment lang="en">Caution: CLcr is in L/h in amikacin clearance equation. We use CLcr (ml/min)*0.06 for conversion in the TVCL operation</comment></comments>
      </operation>

      <operation>
        <parameter>V</parameter>
        <formula><![CDATA[
theta_3 = 0.37;
theta_4 = 0.3;

BW = covariate_bodyweight;
ALB = covariate_ALBless35;

TVV1 = theta_3*BW*(1+theta_4*ALB);
return TVV1;
        ]]></formula>
        <comments/>
        </operation>
      </operations>

    <!-- Drug general comments -->

    <comments>
		</comments>

  </drug>
</model>
